id,service_page_faq_id,question_nl,question_en,answer_nl,answer_en,display_order,is_visible,created_at,updated_at
4c71e6df-8189-46b6-88bd-b140441fc284,10012518-f2d1-4733-a27d-0df741220231,Is een architect verplicht voor een vergunning?,Is an architect required for permits?,Bij veel vergunningsplichtige projecten wel. Een architect weet exact welke documenten vereist zijn.,"For many permit-required projects, yes. Architects know exactly which documents are needed.",1,true,2026-01-12 00:16:09.485433+00,2026-01-12 00:16:09.485433+00
55dc74df-3c9e-438f-acfa-80a572fd4b73,10012518-f2d1-4733-a27d-0df741220231,Wat is het verschil tussen een architect en een tekenaar?,What is the difference between an architect and a draftsman?,Een architect ontwerpt en denkt conceptueel mee; een tekenaar werkt voornamelijk technisch uit.,An architect designs conceptually; a draftsman focuses on technical drawings.,3,true,2026-01-12 00:18:23.704444+00,2026-01-12 00:18:23.704444+00
668aaac0-9ac3-421e-a29c-b7d72fa395fe,10012518-f2d1-4733-a27d-0df741220231,Wat kost een architect gemiddeld?,What does an architect cost on average?,Dat verschilt per projecttype en complexiteit. Een prijsindicatie vind je verderop op deze pagina.,Costs vary depending on project type and complexity. Price indications are listed below.,0,true,2026-01-12 00:14:27.520799+00,2026-01-12 00:16:49.983+00
e39c2bbb-b4f4-4f08-9514-db9d8a41e797,10012518-f2d1-4733-a27d-0df741220231,Kan een architect helpen bij kleine verbouwingen?,Can an architect help with small renovations?,"Ja, zoals aanbouwen, uitbouwen, dakkapellen en interne herindelingen.","Yes, such as extensions, dormers, and internal redesigns.",2,true,2026-01-12 00:17:26.714321+00,2026-01-12 00:17:26.714321+00
f49266c0-f277-4767-a847-31751b72b65d,10012518-f2d1-4733-a27d-0df741220231,Bieden architecten bouwbegeleiding aan?,Do architects offer construction supervision?,"Veel architecten doen dit, afhankelijk van hun specialisatie.","Many do, depending on their expertise.",4,true,2026-01-12 00:18:58.294983+00,2026-01-12 00:18:58.294983+00